<?xml version="1.0"?>
<!DOCTYPE Report
[
<!ELEMENT Report (General ,(Doc|BPT)) >
<!ATTLIST Report ver CDATA #REQUIRED tmZone CDATA #REQUIRED>

<!ELEMENT General ( DocLocation ) >
<!ATTLIST General productName CDATA #REQUIRED productVer CDATA #REQUIRED os CDATA #REQUIRED host CDATA #REQUIRED qcserver CDATA #IMPLIED qcproject CDATA #IMPLIED SolManSolutionId CDATA #IMPLIED SolManProjectId CDATA #IMPLIED SolManTestPlanId CDATA #IMPLIED SolManTestPackageId CDATA #IMPLIED SolManUserInfoData CDATA #IMPLIED  >

<!ELEMENT BPT (DName,Res,DVer?,TSet?,TInst?,NodeArgs,AdditionalInfo*,Doc*) >
<!ATTLIST BPT rID ID #REQUIRED >

<!ELEMENT Doc (DName,ConfName?,Res,DVer?,TSet?,TInst?,RunType?,DT?,AdditionalInfo*,Step*,DIter*,Step*,Action*,Doc*,Summary?,TestMaintenanceSummary*,NodeArgs?) >
<!ATTLIST Doc rID ID #REQUIRED type (Test|BC|BPTWrapperTest|Flow|Group|Action) "Test" productName CDATA #REQUIRED BCIter CDATA #IMPLIED >

<!ELEMENT RunType ( #PCDATA )>
<!ATTLIST RunType fmStep (False|True) "False" batch (False|True) "False" upDesc (False|True) "False" upChk (False|True) "False" upAS (False|True) "False">

<!ELEMENT DName ( #PCDATA ) >

<!ELEMENT ConfName ( #PCDATA ) >

<!ELEMENT Res ( #PCDATA ) >

<!ELEMENT AdditionalInfo (AdditionalDataName,AdditionalDataValue ) >

<!ELEMENT AdditionalDataName ( #PCDATA ) >

<!ELEMENT AdditionalDataValue ( #PCDATA ) >

<!ELEMENT DVer ( #PCDATA ) >

<!ELEMENT TSet ( #PCDATA ) >

<!ELEMENT TInst ( #PCDATA ) >

<!ELEMENT DIter (Step*,Action+,Summary?,NodeArgs)>
<!ATTLIST DIter rID ID #REQUIRED iterID CDATA #REQUIRED>

<!ELEMENT DocLocation ( #PCDATA )>

<!ELEMENT Action (AName,AIter*,(Step|HtmlStep|Action)*, Summary,ActionMaintenanceSummary*, NodeArgs ) >
<!ATTLIST Action rID ID #REQUIRED>

<!ELEMENT AIter ((Step|HtmlStep|Action)*,DataMapping?, Summary?,NodeArgs) >
<!ATTLIST AIter rID ID #REQUIRED iterID CDATA #REQUIRED isCountable (False|True) "False" >

<!ELEMENT AName ( #PCDATA ) >

<!ELEMENT TestMaintenanceSummary (ActionMaintenanceSummary*) >
<!ATTLIST TestMaintenanceSummary ObjectsAdded CDATA #REQUIRED ObjectsUpdated CDATA #REQUIRED StepsUpdated CDATA #REQUIRED StepsComments CDATA #REQUIRED><!ELEMENT ActionMaintenanceSummary (ObjectChange* ) >
<!ATTLIST ActionMaintenanceSummary Action CDATA #REQUIRED Objects CDATA #REQUIRED Updated CDATA #REQUIRED LinesTotal CDATA #REQUIRED Added CDATA #REQUIRED LinesUpdated CDATA #REQUIRED>

<!ELEMENT ObjectChange  (Hierarchy, PropertyChangeList* ) >
<!ATTLIST ObjectChange Operation CDATA #IMPLIED OriginalRepository CDATA #IMPLIED>

<!ELEMENT PropertyChangeList (PropertyDef*) >

<!ELEMENT PropertyDef (OriginalValue, NewValue) >
<!ATTLIST PropertyDef PropName CDATA #REQUIRED OriginRegularExpression (True|False) "False" NewRegularExpression (True|False) "False" AddedProperty (True|False) "False" >

<!ELEMENT OriginalValue ( #PCDATA )>

<!ELEMENT NewValue ( #PCDATA )>

<!ELEMENT Hierarchy  (ObjectName, Hierarchy*) >
<!ATTLIST Hierarchy MicClass CDATA #REQUIRED>

<!ELEMENT ObjectName  ( #PCDATA ) >

<!ELEMENT Step (Obj,Details,Time,TimeTick* ,(Step|HtmlStep|Doc)*, DataMapping?, NodeArgs) >
<!ATTLIST Step rID ID #REQUIRED retval CDATA #IMPLIED>

<!ELEMENT HtmlStep (HTML,TimeTick*,(Step|HtmlStep|Doc)*,NodeArgs) >
<!ATTLIST HtmlStep rID ID #REQUIRED >

<!ELEMENT Obj ( #PCDATA ) >
<!ATTLIST Obj plainTxt (False|True) "True">

<!ELEMENT Details ( #PCDATA ) >
<!ATTLIST Details plainTxt (False|True) "True">

<!ELEMENT Time ( #PCDATA ) >

<!ELEMENT HTML ( #PCDATA ) >

<!ELEMENT Disp ( #PCDATA ) >

<!ELEMENT TimeTick ( #PCDATA ) >

<!ELEMENT DataMapping ( DataMappedItem* )>
<!ELEMENT DataMappedItem EMPTY >
<!ATTLIST DataMappedItem dsName CDATA #REQUIRED >
<!ATTLIST DataMappedItem rowId CDATA #REQUIRED >

<!ELEMENT NodeArgs (Disp,TopPane?,BtmPane?,ExtendedInfo? )>
<!ATTLIST NodeArgs eType CDATA #REQUIRED icon CDATA #REQUIRED nRep CDATA #REQUIRED UserNote CDATA #IMPLIED filter (False|True) "True">
<!ATTLIST NodeArgs status (Passed|Failed|Done|Warning|Information) "Done">
<!ATTLIST NodeArgs iconSel CDATA #IMPLIED nType CDATA #IMPLIED MovieMarker CDATA "">
<!ATTLIST NodeArgs Source CDATA #IMPLIED SourceLine CDATA #IMPLIED StepFlowItemKey CDATA #IMPLIED >

<!ELEMENT TopPane (Path)>

<!ELEMENT BtmPane ( (Path|WR)?,ASHilite?)>
<!ATTLIST BtmPane vType CDATA "HTML">

<!ELEMENT Path ( #PCDATA ) >

<!ELEMENT ASHilite ( #PCDATA ) >

<!ELEMENT WR ( #PCDATA ) >

<!ELEMENT ExtendedInfo ( StepData ) >

<!ATTLIST ExtendedInfo StepType CDATA #REQUIRED>
<!ELEMENT DT (NodeArgs) >
<!ATTLIST DT rID ID #REQUIRED>

<!ELEMENT Summary (Param*)>
<!ATTLIST Summary sTime CDATA #IMPLIED eTime CDATA #IMPLIED passed CDATA #IMPLIED failed CDATA #IMPLIED warnings CDATA #IMPLIED retval CDATA #IMPLIED stopped (False|True) "False" >

<!ELEMENT Param (ParamName,ParamVal)+ >
<!ATTLIST Param paramInOut (In|Out) "In">

<!ELEMENT ParamName ( #PCDATA ) >

<!ELEMENT ParamVal ( #PCDATA ) >

]
>
<Report ver="2.0" tmZone="Pacific Standard Time">
<General productName="HP Unified Functional Testing" productVer="11.50" os="Windows 7" host="VDI-MCSV2-14"><DocLocation><![CDATA[C:\Users\pkrishna\Desktop\Automate\TestDriver]]></DocLocation></General>
<Doc rID="T1"   productName= "HP Unified Functional Testing"  >
<DName><![CDATA[TestDriver]]></DName>
<Res><![CDATA[Res2]]></Res>
<DT rID="T2">
<NodeArgs eType="Table" icon="2" nRep="4" filter="False" >
<Disp><![CDATA[Run-Time Data Table]]></Disp>
<BtmPane vType="Table" >
<Path><![CDATA[Default.xls]]></Path>
</BtmPane>
</NodeArgs>
</DT>
<Action rID="T3">
<AName><![CDATA[Action1]]></AName>
<Step rID="T4">
<Obj plainTxt="False" ><![CDATA[SystemUtil]]></Obj>
<Details plainTxt="False" ><![CDATA[SystemUtil]]></Details>
<Time><![CDATA[4/28/2015 - 23:42:17]]></Time>
<TimeTick>1430289737</TimeTick>
<Step rID="T5">
<Obj plainTxt="False" ><![CDATA[Run "mcs_saa.exe",1]]></Obj>
<Details plainTxt="False" ><![CDATA[Run "mcs_saa.exe",1]]></Details>
<Time><![CDATA[4/28/2015 - 23:42:17]]></Time>
<TimeTick>1430289737</TimeTick>
<NodeArgs eType="Replay" icon="4" nRep="10" status="Passed" >
<Disp><![CDATA[Run "mcs_saa.exe",1]]></Disp>
</NodeArgs>
</Step>
<NodeArgs eType="Replay" icon="4" nRep="9" status="Passed" >
<Disp><![CDATA[SystemUtil]]></Disp>
</NodeArgs>
</Step>
<Step rID="T6">
<Obj ><![CDATA[Launch and Login to SAA Application]]></Obj>
<Details ><![CDATA[Application <b><i>mcs_saa.exe</i></b> is launched successfully]]></Details>
<Time><![CDATA[4/28/2015 - 23:42:19]]></Time>
<TimeTick>1430289739</TimeTick>
<NodeArgs eType="User" icon="5" nRep="11" >
<Disp><![CDATA[Launch and Login to SAA Application]]></Disp>
</NodeArgs>
</Step>
<Step rID="T7">
<Obj plainTxt="False" ><![CDATA[Pb_wdwSAALogin]]></Obj>
<Details plainTxt="False" ><![CDATA[PbWindow]]></Details>
<Time><![CDATA[4/28/2015 - 23:42:22]]></Time>
<TimeTick>1430289742</TimeTick>
<Step rID="T8">
<Obj plainTxt="False" ><![CDATA[Pb_wdwSAALogin.Exist]]></Obj>
<Details plainTxt="False" ><![CDATA["Object does not exist"]]></Details>
<Time><![CDATA[4/28/2015 - 23:42:22]]></Time>
<TimeTick>1430289742</TimeTick>
<NodeArgs eType="Replay" icon="6" nRep="14" >
<Disp><![CDATA[Pb_wdwSAALogin.Exist]]></Disp>
</NodeArgs>
</Step>
<Step rID="T9">
<Obj plainTxt="False" ><![CDATA[Pb_wdwSAALogin.Exist]]></Obj>
<Details plainTxt="False" ><![CDATA["Object does not exist"]]></Details>
<Time><![CDATA[4/28/2015 - 23:42:24]]></Time>
<TimeTick>1430289744</TimeTick>
<NodeArgs eType="Replay" icon="6" nRep="16" >
<Disp><![CDATA[Pb_wdwSAALogin.Exist]]></Disp>
</NodeArgs>
</Step>
<Step rID="T10">
<Obj plainTxt="False" ><![CDATA[Pb_wdwSAALogin.Exist]]></Obj>
<Details plainTxt="False" ><![CDATA["Object does not exist"]]></Details>
<Time><![CDATA[4/28/2015 - 23:42:27]]></Time>
<TimeTick>1430289747</TimeTick>
<NodeArgs eType="Replay" icon="6" nRep="18" >
<Disp><![CDATA[Pb_wdwSAALogin.Exist]]></Disp>
</NodeArgs>
</Step>
<Step rID="T11">
<Obj plainTxt="False" ><![CDATA[Pb_wdwSAALogin.Exist]]></Obj>
<Details plainTxt="False" ><![CDATA["Object does not exist"]]></Details>
<Time><![CDATA[4/28/2015 - 23:42:30]]></Time>
<TimeTick>1430289750</TimeTick>
<NodeArgs eType="Replay" icon="6" nRep="20" >
<Disp><![CDATA[Pb_wdwSAALogin.Exist]]></Disp>
</NodeArgs>
</Step>
<Step rID="T12">
<Obj plainTxt="False" ><![CDATA[Pb_wdwSAALogin.Exist]]></Obj>
<Details plainTxt="False" ><![CDATA["Object does not exist"]]></Details>
<Time><![CDATA[4/28/2015 - 23:42:33]]></Time>
<TimeTick>1430289753</TimeTick>
<NodeArgs eType="Replay" icon="6" nRep="22" >
<Disp><![CDATA[Pb_wdwSAALogin.Exist]]></Disp>
</NodeArgs>
</Step>
<Step rID="T13">
<Obj plainTxt="False" ><![CDATA[Pb_wdwSAALogin.Exist]]></Obj>
<Details plainTxt="False" ><![CDATA["Object does not exist"]]></Details>
<Time><![CDATA[4/28/2015 - 23:42:36]]></Time>
<TimeTick>1430289756</TimeTick>
<NodeArgs eType="Replay" icon="6" nRep="24" >
<Disp><![CDATA[Pb_wdwSAALogin.Exist]]></Disp>
</NodeArgs>
</Step>
<Step rID="T14">
<Obj plainTxt="False" ><![CDATA[Pb_wdwSAALogin.Exist]]></Obj>
<Details plainTxt="False" ><![CDATA["Object does not exist"]]></Details>
<Time><![CDATA[4/28/2015 - 23:42:39]]></Time>
<TimeTick>1430289759</TimeTick>
<NodeArgs eType="Replay" icon="6" nRep="26" >
<Disp><![CDATA[Pb_wdwSAALogin.Exist]]></Disp>
</NodeArgs>
</Step>
<Step rID="T15">
<Obj plainTxt="False" ><![CDATA[Pb_wdwSAALogin.Exist]]></Obj>
<Details plainTxt="False" ><![CDATA["Object does not exist"]]></Details>
<Time><![CDATA[4/28/2015 - 23:42:41]]></Time>
<TimeTick>1430289761</TimeTick>
<NodeArgs eType="Replay" icon="6" nRep="28" >
<Disp><![CDATA[Pb_wdwSAALogin.Exist]]></Disp>
</NodeArgs>
</Step>
<Step rID="T16">
<Obj plainTxt="False" ><![CDATA[Pb_wdwSAALogin.Exist]]></Obj>
<Details plainTxt="False" ><![CDATA["Object does not exist"]]></Details>
<Time><![CDATA[4/28/2015 - 23:42:44]]></Time>
<TimeTick>1430289764</TimeTick>
<NodeArgs eType="Replay" icon="6" nRep="30" >
<Disp><![CDATA[Pb_wdwSAALogin.Exist]]></Disp>
</NodeArgs>
</Step>
<Step rID="T17">
<Obj plainTxt="False" ><![CDATA[Pb_wdwSAALogin.Exist]]></Obj>
<Details plainTxt="False" ><![CDATA["Object does not exist"]]></Details>
<Time><![CDATA[4/28/2015 - 23:42:47]]></Time>
<TimeTick>1430289767</TimeTick>
<NodeArgs eType="Replay" icon="6" nRep="32" >
<Disp><![CDATA[Pb_wdwSAALogin.Exist]]></Disp>
</NodeArgs>
</Step>
<Step rID="T18">
<Obj plainTxt="False" ><![CDATA[Pb_wdwSAALogin.Exist]]></Obj>
<Details plainTxt="False" ><![CDATA["Object does not exist"]]></Details>
<Time><![CDATA[4/28/2015 - 23:42:48]]></Time>
<TimeTick>1430289768</TimeTick>
<NodeArgs eType="Replay" icon="6" nRep="34" >
<Disp><![CDATA[Pb_wdwSAALogin.Exist]]></Disp>
</NodeArgs>
</Step>
<NodeArgs eType="Context" icon="6" nRep="13" >
<Disp><![CDATA[Pb_wdwSAALogin]]></Disp>
</NodeArgs>
</Step>
<Step rID="T19">
<Obj ><![CDATA[<font color="red">User  should be displayed with GQA Lauch screen</font>]]></Obj>
<Details ><![CDATA[<font color="red">Navigation is unsuccessful</font>]]></Details>
<Time><![CDATA[4/28/2015 - 23:42:48]]></Time>
<TimeTick>1430289768</TimeTick>
<NodeArgs eType="User" icon="5" nRep="35" status="Failed" >
<Disp><![CDATA[<font color="red">User  should be displayed with GQA Lauch screen</font>]]></Disp>
</NodeArgs>
</Step>
<Step rID="T20">
<Obj plainTxt="False" ><![CDATA[SystemUtil]]></Obj>
<Details plainTxt="False" ><![CDATA[SystemUtil]]></Details>
<Time><![CDATA[4/28/2015 - 23:43:16]]></Time>
<TimeTick>1430289796</TimeTick>
<Step rID="T21">
<Obj plainTxt="False" ><![CDATA[Run "mcs_saa.exe",1]]></Obj>
<Details plainTxt="False" ><![CDATA[Run "mcs_saa.exe",1]]></Details>
<Time><![CDATA[4/28/2015 - 23:43:16]]></Time>
<TimeTick>1430289796</TimeTick>
<NodeArgs eType="Replay" icon="4" nRep="39" status="Passed" >
<Disp><![CDATA[Run "mcs_saa.exe",1]]></Disp>
</NodeArgs>
</Step>
<NodeArgs eType="Replay" icon="4" nRep="38" status="Passed" >
<Disp><![CDATA[SystemUtil]]></Disp>
</NodeArgs>
</Step>
<Step rID="T22">
<Obj ><![CDATA[Launch and Login to SAA Application]]></Obj>
<Details ><![CDATA[Application <b><i>mcs_saa.exe</i></b> is launched successfully]]></Details>
<Time><![CDATA[4/28/2015 - 23:43:18]]></Time>
<TimeTick>1430289798</TimeTick>
<NodeArgs eType="User" icon="5" nRep="40" >
<Disp><![CDATA[Launch and Login to SAA Application]]></Disp>
</NodeArgs>
</Step>
<Step rID="T23">
<Obj plainTxt="False" ><![CDATA[Pb_wdwSAALogin]]></Obj>
<Details plainTxt="False" ><![CDATA[PbWindow]]></Details>
<Time><![CDATA[4/28/2015 - 23:43:21]]></Time>
<TimeTick>1430289801</TimeTick>
<Step rID="T24">
<Obj plainTxt="False" ><![CDATA[Pb_wdwSAALogin.Exist]]></Obj>
<Details plainTxt="False" ><![CDATA["Object does not exist"]]></Details>
<Time><![CDATA[4/28/2015 - 23:43:21]]></Time>
<TimeTick>1430289801</TimeTick>
<NodeArgs eType="Replay" icon="6" nRep="43" >
<Disp><![CDATA[Pb_wdwSAALogin.Exist]]></Disp>
</NodeArgs>
</Step>
<Step rID="T25">
<Obj plainTxt="False" ><![CDATA[Pb_wdwSAALogin.Exist]]></Obj>
<Details plainTxt="False" ><![CDATA["Object does not exist"]]></Details>
<Time><![CDATA[4/28/2015 - 23:43:24]]></Time>
<TimeTick>1430289804</TimeTick>
<NodeArgs eType="Replay" icon="6" nRep="45" >
<Disp><![CDATA[Pb_wdwSAALogin.Exist]]></Disp>
</NodeArgs>
</Step>
<Step rID="T26">
<Obj plainTxt="False" ><![CDATA[Pb_wdwSAALogin.Exist]]></Obj>
<Details plainTxt="False" ><![CDATA["Object does not exist"]]></Details>
<Time><![CDATA[4/28/2015 - 23:43:27]]></Time>
<TimeTick>1430289807</TimeTick>
<NodeArgs eType="Replay" icon="6" nRep="47" >
<Disp><![CDATA[Pb_wdwSAALogin.Exist]]></Disp>
</NodeArgs>
</Step>
<Step rID="T27">
<Obj plainTxt="False" ><![CDATA[Pb_wdwSAALogin.Exist]]></Obj>
<Details plainTxt="False" ><![CDATA["Object does not exist"]]></Details>
<Time><![CDATA[4/28/2015 - 23:43:30]]></Time>
<TimeTick>1430289810</TimeTick>
<NodeArgs eType="Replay" icon="6" nRep="49" >
<Disp><![CDATA[Pb_wdwSAALogin.Exist]]></Disp>
</NodeArgs>
</Step>
<Step rID="T28">
<Obj plainTxt="False" ><![CDATA[Pb_wdwSAALogin.Exist]]></Obj>
<Details plainTxt="False" ><![CDATA["Object does not exist"]]></Details>
<Time><![CDATA[4/28/2015 - 23:43:33]]></Time>
<TimeTick>1430289813</TimeTick>
<NodeArgs eType="Replay" icon="6" nRep="51" >
<Disp><![CDATA[Pb_wdwSAALogin.Exist]]></Disp>
</NodeArgs>
</Step>
<Step rID="T29">
<Obj plainTxt="False" ><![CDATA[Pb_wdwSAALogin.Exist]]></Obj>
<Details plainTxt="False" ><![CDATA["Object does not exist"]]></Details>
<Time><![CDATA[4/28/2015 - 23:43:36]]></Time>
<TimeTick>1430289816</TimeTick>
<NodeArgs eType="Replay" icon="6" nRep="53" >
<Disp><![CDATA[Pb_wdwSAALogin.Exist]]></Disp>
</NodeArgs>
</Step>
<Step rID="T30">
<Obj plainTxt="False" ><![CDATA[Pb_wdwSAALogin.Exist]]></Obj>
<Details plainTxt="False" ><![CDATA["Object does not exist"]]></Details>
<Time><![CDATA[4/28/2015 - 23:43:39]]></Time>
<TimeTick>1430289819</TimeTick>
<NodeArgs eType="Replay" icon="6" nRep="55" >
<Disp><![CDATA[Pb_wdwSAALogin.Exist]]></Disp>
</NodeArgs>
</Step>
<Step rID="T31">
<Obj plainTxt="False" ><![CDATA[Pb_wdwSAALogin.Exist]]></Obj>
<Details plainTxt="False" ><![CDATA["Object does not exist"]]></Details>
<Time><![CDATA[4/28/2015 - 23:43:41]]></Time>
<TimeTick>1430289821</TimeTick>
<NodeArgs eType="Replay" icon="6" nRep="57" >
<Disp><![CDATA[Pb_wdwSAALogin.Exist]]></Disp>
</NodeArgs>
</Step>
<Step rID="T32">
<Obj plainTxt="False" ><![CDATA[Pb_wdwSAALogin.Exist]]></Obj>
<Details plainTxt="False" ><![CDATA["Object does not exist"]]></Details>
<Time><![CDATA[4/28/2015 - 23:43:44]]></Time>
<TimeTick>1430289824</TimeTick>
<NodeArgs eType="Replay" icon="6" nRep="59" >
<Disp><![CDATA[Pb_wdwSAALogin.Exist]]></Disp>
</NodeArgs>
</Step>
<Step rID="T33">
<Obj plainTxt="False" ><![CDATA[Pb_wdwSAALogin.Exist]]></Obj>
<Details plainTxt="False" ><![CDATA["Object does not exist"]]></Details>
<Time><![CDATA[4/28/2015 - 23:43:47]]></Time>
<TimeTick>1430289827</TimeTick>
<NodeArgs eType="Replay" icon="6" nRep="61" >
<Disp><![CDATA[Pb_wdwSAALogin.Exist]]></Disp>
</NodeArgs>
</Step>
<Step rID="T34">
<Obj plainTxt="False" ><![CDATA[Pb_wdwSAALogin.Exist]]></Obj>
<Details plainTxt="False" ><![CDATA["Object does not exist"]]></Details>
<Time><![CDATA[4/28/2015 - 23:43:49]]></Time>
<TimeTick>1430289829</TimeTick>
<NodeArgs eType="Replay" icon="6" nRep="63" >
<Disp><![CDATA[Pb_wdwSAALogin.Exist]]></Disp>
</NodeArgs>
</Step>
<NodeArgs eType="Context" icon="6" nRep="42" >
<Disp><![CDATA[Pb_wdwSAALogin]]></Disp>
</NodeArgs>
</Step>
<Step rID="T35">
<Obj ><![CDATA[<font color="red">User  should be displayed with GQA Lauch screen</font>]]></Obj>
<Details ><![CDATA[<font color="red">Navigation is unsuccessful</font>]]></Details>
<Time><![CDATA[4/28/2015 - 23:43:49]]></Time>
<TimeTick>1430289829</TimeTick>
<NodeArgs eType="User" icon="5" nRep="64" status="Failed" >
<Disp><![CDATA[<font color="red">User  should be displayed with GQA Lauch screen</font>]]></Disp>
</NodeArgs>
</Step>
<Step rID="T36">
<Obj plainTxt="False" ><![CDATA[SystemUtil]]></Obj>
<Details plainTxt="False" ><![CDATA[SystemUtil]]></Details>
<Time><![CDATA[4/28/2015 - 23:44:04]]></Time>
<TimeTick>1430289844</TimeTick>
<Step rID="T37">
<Obj plainTxt="False" ><![CDATA[Run "mcs_saa.exe",1]]></Obj>
<Details plainTxt="False" ><![CDATA[Run "mcs_saa.exe",1]]></Details>
<Time><![CDATA[4/28/2015 - 23:44:04]]></Time>
<TimeTick>1430289844</TimeTick>
<NodeArgs eType="Replay" icon="4" nRep="68" status="Passed" >
<Disp><![CDATA[Run "mcs_saa.exe",1]]></Disp>
</NodeArgs>
</Step>
<NodeArgs eType="Replay" icon="4" nRep="67" status="Passed" >
<Disp><![CDATA[SystemUtil]]></Disp>
</NodeArgs>
</Step>
<Step rID="T38">
<Obj ><![CDATA[Launch and Login to SAA Application]]></Obj>
<Details ><![CDATA[Application <b><i>mcs_saa.exe</i></b> is launched successfully]]></Details>
<Time><![CDATA[4/28/2015 - 23:44:06]]></Time>
<TimeTick>1430289846</TimeTick>
<NodeArgs eType="User" icon="5" nRep="69" >
<Disp><![CDATA[Launch and Login to SAA Application]]></Disp>
</NodeArgs>
</Step>
<Step rID="T39">
<Obj plainTxt="False" ><![CDATA[Pb_wdwSAALogin]]></Obj>
<Details plainTxt="False" ><![CDATA[PbWindow]]></Details>
<Time><![CDATA[4/28/2015 - 23:44:09]]></Time>
<TimeTick>1430289849</TimeTick>
<Step rID="T40">
<Obj plainTxt="False" ><![CDATA[Pb_wdwSAALogin.Exist]]></Obj>
<Details plainTxt="False" ><![CDATA["Object does not exist"]]></Details>
<Time><![CDATA[4/28/2015 - 23:44:09]]></Time>
<TimeTick>1430289849</TimeTick>
<NodeArgs eType="Replay" icon="6" nRep="72" >
<Disp><![CDATA[Pb_wdwSAALogin.Exist]]></Disp>
</NodeArgs>
</Step>
<Step rID="T41">
<Obj plainTxt="False" ><![CDATA[Pb_wdwSAALogin.Exist]]></Obj>
<Details plainTxt="False" ><![CDATA["Object does not exist"]]></Details>
<Time><![CDATA[4/28/2015 - 23:44:12]]></Time>
<TimeTick>1430289852</TimeTick>
<NodeArgs eType="Replay" icon="6" nRep="74" >
<Disp><![CDATA[Pb_wdwSAALogin.Exist]]></Disp>
</NodeArgs>
</Step>
<Step rID="T42">
<Obj plainTxt="False" ><![CDATA[Pb_wdwSAALogin.Exist]]></Obj>
<Details plainTxt="False" ><![CDATA["Object does not exist"]]></Details>
<Time><![CDATA[4/28/2015 - 23:44:15]]></Time>
<TimeTick>1430289855</TimeTick>
<NodeArgs eType="Replay" icon="6" nRep="76" >
<Disp><![CDATA[Pb_wdwSAALogin.Exist]]></Disp>
</NodeArgs>
</Step>
<Step rID="T43">
<Obj plainTxt="False" ><![CDATA[Pb_wdwSAALogin.Exist]]></Obj>
<Details plainTxt="False" ><![CDATA["Object does not exist"]]></Details>
<Time><![CDATA[4/28/2015 - 23:44:18]]></Time>
<TimeTick>1430289858</TimeTick>
<NodeArgs eType="Replay" icon="6" nRep="78" >
<Disp><![CDATA[Pb_wdwSAALogin.Exist]]></Disp>
</NodeArgs>
</Step>
<Step rID="T44">
<Obj plainTxt="False" ><![CDATA[Pb_wdwSAALogin.Exist]]></Obj>
<Details plainTxt="False" ><![CDATA["Object does not exist"]]></Details>
<Time><![CDATA[4/28/2015 - 23:44:21]]></Time>
<TimeTick>1430289861</TimeTick>
<NodeArgs eType="Replay" icon="6" nRep="80" >
<Disp><![CDATA[Pb_wdwSAALogin.Exist]]></Disp>
</NodeArgs>
</Step>
<Step rID="T45">
<Obj plainTxt="False" ><![CDATA[Pb_wdwSAALogin.Exist]]></Obj>
<Details plainTxt="False" ><![CDATA["Object does not exist"]]></Details>
<Time><![CDATA[4/28/2015 - 23:44:23]]></Time>
<TimeTick>1430289863</TimeTick>
<NodeArgs eType="Replay" icon="6" nRep="82" >
<Disp><![CDATA[Pb_wdwSAALogin.Exist]]></Disp>
</NodeArgs>
</Step>
<Step rID="T46">
<Obj plainTxt="False" ><![CDATA[Pb_wdwSAALogin.Exist]]></Obj>
<Details plainTxt="False" ><![CDATA["Object does not exist"]]></Details>
<Time><![CDATA[4/28/2015 - 23:44:26]]></Time>
<TimeTick>1430289866</TimeTick>
<NodeArgs eType="Replay" icon="6" nRep="84" >
<Disp><![CDATA[Pb_wdwSAALogin.Exist]]></Disp>
</NodeArgs>
</Step>
<Step rID="T47">
<Obj plainTxt="False" ><![CDATA[Pb_wdwSAALogin.Exist]]></Obj>
<Details plainTxt="False" ><![CDATA["Object does not exist"]]></Details>
<Time><![CDATA[4/28/2015 - 23:44:29]]></Time>
<TimeTick>1430289869</TimeTick>
<NodeArgs eType="Replay" icon="6" nRep="86" >
<Disp><![CDATA[Pb_wdwSAALogin.Exist]]></Disp>
</NodeArgs>
</Step>
<Step rID="T48">
<Obj plainTxt="False" ><![CDATA[Pb_wdwSAALogin.Exist]]></Obj>
<Details plainTxt="False" ><![CDATA["Object does not exist"]]></Details>
<Time><![CDATA[4/28/2015 - 23:44:32]]></Time>
<TimeTick>1430289872</TimeTick>
<NodeArgs eType="Replay" icon="6" nRep="88" >
<Disp><![CDATA[Pb_wdwSAALogin.Exist]]></Disp>
</NodeArgs>
</Step>
<Step rID="T49">
<Obj plainTxt="False" ><![CDATA[Pb_wdwSAALogin.Exist]]></Obj>
<Details plainTxt="False" ><![CDATA["Object does not exist"]]></Details>
<Time><![CDATA[4/28/2015 - 23:44:34]]></Time>
<TimeTick>1430289874</TimeTick>
<NodeArgs eType="Replay" icon="6" nRep="90" >
<Disp><![CDATA[Pb_wdwSAALogin.Exist]]></Disp>
</NodeArgs>
</Step>
<Step rID="T50">
<Obj plainTxt="False" ><![CDATA[Pb_wdwSAALogin.Exist]]></Obj>
<Details plainTxt="False" ><![CDATA["Object does not exist"]]></Details>
<Time><![CDATA[4/28/2015 - 23:44:36]]></Time>
<TimeTick>1430289876</TimeTick>
<NodeArgs eType="Replay" icon="6" nRep="92" >
<Disp><![CDATA[Pb_wdwSAALogin.Exist]]></Disp>
</NodeArgs>
</Step>
<NodeArgs eType="Context" icon="6" nRep="71" >
<Disp><![CDATA[Pb_wdwSAALogin]]></Disp>
</NodeArgs>
</Step>
<Step rID="T51">
<Obj ><![CDATA[<font color="red">User  should be displayed with GQA Lauch screen</font>]]></Obj>
<Details ><![CDATA[<font color="red">Navigation is unsuccessful</font>]]></Details>
<Time><![CDATA[4/28/2015 - 23:44:36]]></Time>
<TimeTick>1430289876</TimeTick>
<NodeArgs eType="User" icon="5" nRep="93" status="Failed" >
<Disp><![CDATA[<font color="red">User  should be displayed with GQA Lauch screen</font>]]></Disp>
</NodeArgs>
</Step>
<Step rID="T52">
<Obj plainTxt="False" ><![CDATA[SystemUtil]]></Obj>
<Details plainTxt="False" ><![CDATA[SystemUtil]]></Details>
<Time><![CDATA[4/28/2015 - 23:44:52]]></Time>
<TimeTick>1430289892</TimeTick>
<Step rID="T53">
<Obj plainTxt="False" ><![CDATA[Run "mcs_saa.exe",1]]></Obj>
<Details plainTxt="False" ><![CDATA[Run "mcs_saa.exe",1]]></Details>
<Time><![CDATA[4/28/2015 - 23:44:52]]></Time>
<TimeTick>1430289892</TimeTick>
<NodeArgs eType="Replay" icon="4" nRep="97" status="Passed" >
<Disp><![CDATA[Run "mcs_saa.exe",1]]></Disp>
</NodeArgs>
</Step>
<NodeArgs eType="Replay" icon="4" nRep="96" status="Passed" >
<Disp><![CDATA[SystemUtil]]></Disp>
</NodeArgs>
</Step>
<Step rID="T54">
<Obj ><![CDATA[Launch and Login to SAA Application]]></Obj>
<Details ><![CDATA[Application <b><i>mcs_saa.exe</i></b> is launched successfully]]></Details>
<Time><![CDATA[4/28/2015 - 23:44:54]]></Time>
<TimeTick>1430289894</TimeTick>
<NodeArgs eType="User" icon="5" nRep="98" >
<Disp><![CDATA[Launch and Login to SAA Application]]></Disp>
</NodeArgs>
</Step>
<Step rID="T55">
<Obj plainTxt="False" ><![CDATA[Pb_wdwSAALogin]]></Obj>
<Details plainTxt="False" ><![CDATA[PbWindow]]></Details>
<Time><![CDATA[4/28/2015 - 23:44:57]]></Time>
<TimeTick>1430289897</TimeTick>
<Step rID="T56">
<Obj plainTxt="False" ><![CDATA[Pb_wdwSAALogin.Exist]]></Obj>
<Details plainTxt="False" ><![CDATA["Object does not exist"]]></Details>
<Time><![CDATA[4/28/2015 - 23:44:57]]></Time>
<TimeTick>1430289897</TimeTick>
<NodeArgs eType="Replay" icon="6" nRep="101" >
<Disp><![CDATA[Pb_wdwSAALogin.Exist]]></Disp>
</NodeArgs>
</Step>
<Step rID="T57">
<Obj plainTxt="False" ><![CDATA[Pb_wdwSAALogin.Exist]]></Obj>
<Details plainTxt="False" ><![CDATA["Object does not exist"]]></Details>
<Time><![CDATA[4/28/2015 - 23:45:00]]></Time>
<TimeTick>1430289900</TimeTick>
<NodeArgs eType="Replay" icon="6" nRep="103" >
<Disp><![CDATA[Pb_wdwSAALogin.Exist]]></Disp>
</NodeArgs>
</Step>
<Step rID="T58">
<Obj plainTxt="False" ><![CDATA[Pb_wdwSAALogin.Exist]]></Obj>
<Details plainTxt="False" ><![CDATA["Object does not exist"]]></Details>
<Time><![CDATA[4/28/2015 - 23:45:02]]></Time>
<TimeTick>1430289902</TimeTick>
<NodeArgs eType="Replay" icon="6" nRep="105" >
<Disp><![CDATA[Pb_wdwSAALogin.Exist]]></Disp>
</NodeArgs>
</Step>
<Step rID="T59">
<Obj plainTxt="False" ><![CDATA[Pb_wdwSAALogin.Exist]]></Obj>
<Details plainTxt="False" ><![CDATA["Object does not exist"]]></Details>
<Time><![CDATA[4/28/2015 - 23:45:05]]></Time>
<TimeTick>1430289905</TimeTick>
<NodeArgs eType="Replay" icon="6" nRep="107" >
<Disp><![CDATA[Pb_wdwSAALogin.Exist]]></Disp>
</NodeArgs>
</Step>
<Step rID="T60">
<Obj plainTxt="False" ><![CDATA[Pb_wdwSAALogin.Exist]]></Obj>
<Details plainTxt="False" ><![CDATA["Object does not exist"]]></Details>
<Time><![CDATA[4/28/2015 - 23:45:08]]></Time>
<TimeTick>1430289908</TimeTick>
<NodeArgs eType="Replay" icon="6" nRep="109" >
<Disp><![CDATA[Pb_wdwSAALogin.Exist]]></Disp>
</NodeArgs>
</Step>
<Step rID="T61">
<Obj plainTxt="False" ><![CDATA[Pb_wdwSAALogin.Exist]]></Obj>
<Details plainTxt="False" ><![CDATA["Object does not exist"]]></Details>
<Time><![CDATA[4/28/2015 - 23:45:11]]></Time>
<TimeTick>1430289911</TimeTick>
<NodeArgs eType="Replay" icon="6" nRep="111" >
<Disp><![CDATA[Pb_wdwSAALogin.Exist]]></Disp>
</NodeArgs>
</Step>
<Step rID="T62">
<Obj plainTxt="False" ><![CDATA[Pb_wdwSAALogin.Exist]]></Obj>
<Details plainTxt="False" ><![CDATA["Object does not exist"]]></Details>
<Time><![CDATA[4/28/2015 - 23:45:14]]></Time>
<TimeTick>1430289914</TimeTick>
<NodeArgs eType="Replay" icon="6" nRep="113" >
<Disp><![CDATA[Pb_wdwSAALogin.Exist]]></Disp>
</NodeArgs>
</Step>
<Step rID="T63">
<Obj plainTxt="False" ><![CDATA[Pb_wdwSAALogin.Exist]]></Obj>
<Details plainTxt="False" ><![CDATA["Object does not exist"]]></Details>
<Time><![CDATA[4/28/2015 - 23:45:17]]></Time>
<TimeTick>1430289917</TimeTick>
<NodeArgs eType="Replay" icon="6" nRep="115" >
<Disp><![CDATA[Pb_wdwSAALogin.Exist]]></Disp>
</NodeArgs>
</Step>
<Step rID="T64">
<Obj plainTxt="False" ><![CDATA[Pb_wdwSAALogin.Exist]]></Obj>
<Details plainTxt="False" ><![CDATA["Object does not exist"]]></Details>
<Time><![CDATA[4/28/2015 - 23:45:19]]></Time>
<TimeTick>1430289919</TimeTick>
<NodeArgs eType="Replay" icon="6" nRep="117" >
<Disp><![CDATA[Pb_wdwSAALogin.Exist]]></Disp>
</NodeArgs>
</Step>
<Step rID="T65">
<Obj plainTxt="False" ><![CDATA[Pb_wdwSAALogin.Exist]]></Obj>
<Details plainTxt="False" ><![CDATA["Object does not exist"]]></Details>
<Time><![CDATA[4/28/2015 - 23:45:22]]></Time>
<TimeTick>1430289922</TimeTick>
<NodeArgs eType="Replay" icon="6" nRep="119" >
<Disp><![CDATA[Pb_wdwSAALogin.Exist]]></Disp>
</NodeArgs>
</Step>
<Step rID="T66">
<Obj plainTxt="False" ><![CDATA[Pb_wdwSAALogin.Exist]]></Obj>
<Details plainTxt="False" ><![CDATA["Object does not exist"]]></Details>
<Time><![CDATA[4/28/2015 - 23:45:23]]></Time>
<TimeTick>1430289923</TimeTick>
<NodeArgs eType="Replay" icon="6" nRep="121" >
<Disp><![CDATA[Pb_wdwSAALogin.Exist]]></Disp>
</NodeArgs>
</Step>
<NodeArgs eType="Context" icon="6" nRep="100" >
<Disp><![CDATA[Pb_wdwSAALogin]]></Disp>
</NodeArgs>
</Step>
<Step rID="T67">
<Obj ><![CDATA[<font color="red">User  should be displayed with GQA Lauch screen</font>]]></Obj>
<Details ><![CDATA[<font color="red">Navigation is unsuccessful</font>]]></Details>
<Time><![CDATA[4/28/2015 - 23:45:23]]></Time>
<TimeTick>1430289923</TimeTick>
<NodeArgs eType="User" icon="5" nRep="122" status="Failed" >
<Disp><![CDATA[<font color="red">User  should be displayed with GQA Lauch screen</font>]]></Disp>
</NodeArgs>
</Step>
<Step rID="T68">
<Obj plainTxt="False" ><![CDATA[SystemUtil]]></Obj>
<Details plainTxt="False" ><![CDATA[SystemUtil]]></Details>
<Time><![CDATA[4/28/2015 - 23:45:39]]></Time>
<TimeTick>1430289939</TimeTick>
<Step rID="T69">
<Obj plainTxt="False" ><![CDATA[Run "mcs_saa.exe",1]]></Obj>
<Details plainTxt="False" ><![CDATA[Run "mcs_saa.exe",1]]></Details>
<Time><![CDATA[4/28/2015 - 23:45:39]]></Time>
<TimeTick>1430289939</TimeTick>
<NodeArgs eType="Replay" icon="4" nRep="126" status="Passed" >
<Disp><![CDATA[Run "mcs_saa.exe",1]]></Disp>
</NodeArgs>
</Step>
<NodeArgs eType="Replay" icon="4" nRep="125" status="Passed" >
<Disp><![CDATA[SystemUtil]]></Disp>
</NodeArgs>
</Step>
<Step rID="T70">
<Obj ><![CDATA[Launch and Login to SAA Application]]></Obj>
<Details ><![CDATA[Application <b><i>mcs_saa.exe</i></b> is launched successfully]]></Details>
<Time><![CDATA[4/28/2015 - 23:45:41]]></Time>
<TimeTick>1430289941</TimeTick>
<NodeArgs eType="User" icon="5" nRep="127" >
<Disp><![CDATA[Launch and Login to SAA Application]]></Disp>
</NodeArgs>
</Step>
<Step rID="T71">
<Obj plainTxt="False" ><![CDATA[Pb_wdwSAALogin]]></Obj>
<Details plainTxt="False" ><![CDATA[PbWindow]]></Details>
<Time><![CDATA[4/28/2015 - 23:45:44]]></Time>
<TimeTick>1430289944</TimeTick>
<Step rID="T72">
<Obj plainTxt="False" ><![CDATA[Pb_wdwSAALogin.Exist]]></Obj>
<Details plainTxt="False" ><![CDATA["Object does not exist"]]></Details>
<Time><![CDATA[4/28/2015 - 23:45:44]]></Time>
<TimeTick>1430289944</TimeTick>
<NodeArgs eType="Replay" icon="6" nRep="130" >
<Disp><![CDATA[Pb_wdwSAALogin.Exist]]></Disp>
</NodeArgs>
</Step>
<Step rID="T73">
<Obj plainTxt="False" ><![CDATA[Pb_wdwSAALogin.Exist]]></Obj>
<Details plainTxt="False" ><![CDATA["Object does not exist"]]></Details>
<Time><![CDATA[4/28/2015 - 23:45:47]]></Time>
<TimeTick>1430289947</TimeTick>
<NodeArgs eType="Replay" icon="6" nRep="132" >
<Disp><![CDATA[Pb_wdwSAALogin.Exist]]></Disp>
</NodeArgs>
</Step>
<Step rID="T74">
<Obj plainTxt="False" ><![CDATA[Pb_wdwSAALogin.Exist]]></Obj>
<Details plainTxt="False" ><![CDATA["Object does not exist"]]></Details>